{
      "$schema": "http://json-schema.org/draft-04/schema#",
      "id": "Person",
      "title": "Person",
      "type": "object",
      "properties": {
        "id": {
          "type": "integer",
          "format": "int32"
        },
        "personNb": {
          "type": "integer",
          "format": "int64"
        },
        "login": {
          "type": "string"
        },
        "firstName": {
          "type": "string"
        },
        "lastName": {
          "type": "string"
        },
        "companyCode": {
          "type": "string"
        },
        "isAnonymous": {
          "type": "boolean"
        },
        "phones": {
          "description": "",
          "type": "array",
          "items": {
            "id": "Phone",
            "title": "Phone",
            "type": "object",
            "properties": {
              "number": {
                "type": "string"
              },
              "type": {
                "type": "string"
              }
            }
          }
        },
        "roleAndSignatures": {
          "description": "",
          "type": "array",
          "items": {
            "id": "RoleAndSignature",
            "title": "RoleAndSignature",
            "type": "object",
            "properties": {
              "signature": {
                "type": "string"
              },
              "role": {
                "type": "string"
              }
            }
          }
        }
      }
    }